{
  "schema_version": "rafaelia.shared-data-release/v1",
  "share_id": "SHARE-SYNTHETIC-C3-BLOCK-001",
  "source_locator": "fixture://synthetic/restricted/sample.txt",
  "source_revision_or_sha256": "fixture-v1",
  "source_criticality": "C3_RESTRICTED",
  "fragment_sha256": "1111111111111111111111111111111111111111111111111111111111111111",
  "fragment_size": 256,
  "purpose": "Negative fixture proving that unresolved privacy/semantic risk blocks release.",
  "allowed_repository": "rafaelmeloreisnovo/Mapa",
  "allowed_workflow": "shared-data-release-gate.yml",
  "allowed_operation": "validate_manifest_only",
  "created_at": "2026-08-21T02:49:00-03:00",
  "expires_at": "2099-08-21T02:49:00-03:00",
  "redaction_status": "TOKEN_VAZIO",
  "reidentification_risk": "TOKEN_VAZIO",
  "semantic_reconstruction_risk": "TOKEN_VAZIO",
  "downstream_effects_summary": "Synthetic blocked fixture.",
  "human_awareness_summary": "Unknown reidentification/semantic impact must not be treated as zero risk.",
  "approval_state": "BLOCKED",
  "human_approval": false,
  "revoked": false,
  "credential_or_secret_presence": false,
  "claim_allowed": false,
  "token_vazio": [
    "redaction_status",
    "reidentification_risk",
    "semantic_reconstruction_risk"
  ]
}
